<?xml version="1.0" encoding="ISO-8859-1"?>
<xs:schema xmlns:xs="http://www.w3.org/2001/XMLSchema">

<xs:element name="setting">
 <xs:complexType>
  <xs:sequence>
	<xs:element name="limit" type="xs:int" />
	<xs:element name="config_path" type="xs:string"/>
	<xs:element name="xml" type="xs:string" />
	<xs:element name="xsd" type="xs:string" />
	<xs:element name="dbxml" type="xs:string"/>
	<xs:element name="dbxsd" type="xs:string"/>
	<xs:element name="server_port" type="xs:int"/>
	<xs:element name="admin_server_port" type="xs:int"/>
   </xs:sequence>
  </xs:complexType>
 </xs:element>
</xs:schema>